{
  "id": "token-pacman",
  "name": "Token Pac-Man",
  "description": "Visualizes live session AI-credit usage as a Pac-Man board with pellets, ghosts, fruit milestones, and game-over limits.",
  "version": "1.0.0",
  "author": {
    "name": "James Montemagno",
    "url": "https://github.com/jamesmontemagno"
  },
  "keywords": [
    "ai-credits",
    "copilot-canvas",
    "interactive-canvas",
    "pac-man",
    "quota-tracking",
    "session-usage"
  ],
  "screenshots": {
    "icon": {
      "path": "assets/preview.png",
      "type": "image/png"
    },
    "gallery": {
      "path": "assets/preview.png",
      "type": "image/png"
    }
  }
}