{
  "id": "site-studio",
  "name": "Site Studio",
  "description": "Plan, draft, and track a personal website section by section — a shared canvas where you and your agent author content, watch progress, and review every change.",
  "version": "1.0.0",
  "keywords": [
    "agent-collaboration",
    "content-authoring",
    "personal-website",
    "progress-tracking",
    "section-planning",
    "site-builder"
  ],
  "screenshots": {
    "icon": {
      "path": "assets/preview.png",
      "type": "image/png"
    },
    "gallery": {
      "path": "assets/preview.png",
      "type": "image/png"
    }
  }
}
