{
  "id": "diagram",
  "name": "Diagram Explorer",
  "description": "Lets users render diagrams, click nodes to drill down, and view agent-generated explanations directly in the canvas.",
  "version": "1.0.0",
  "keywords": [
    "architecture-mapping",
    "canvas-navigation",
    "exploratory-analysis",
    "interactive-diagrams",
    "node-drilldown",
    "relationship-visualization"
  ],
  "screenshots": {
    "icon": {
      "path": "assets/preview.png",
      "type": "image/png"
    },
    "gallery": {
      "path": "assets/preview.png",
      "type": "image/png"
    }
  }
}